{
  "schema": "elyne.eval.fixture-toolchain/v1",
  "id": "toolchain",
  "revision": 1,
  "status": "accepted",
  "catalog": {
    "id": "toolchain",
    "revision": 1,
    "sha256": "368613a0435cc158580bb7c62cebb02d027b2dcf9b3e40c156ac7d62a9a4782e"
  },
  "source": {
    "module": "elyne/bench/toolchain_testset.py",
    "sha256": "e3e25b59b87cfe048e0f28443854e554aa6d83e6d39553fff08b0d6904d4c1e6"
  },
  "matcher": {
    "module": "evals/harness/toolchain_matcher.py",
    "sha256": "56736f207a207dc04b5262996160c54d367be4e99f0d670adc700a3d61317260",
    "schema": "elyne.eval.toolchain-matcher/v1"
  },
  "cases": [
    {
      "id": "tc-list-read-01",
      "probe_id": "toolchain.execute",
      "case_type": "procedural-chain",
      "timeout_seconds": 3600,
      "pattern": "list-read",
      "prompt": "Execute une chaine factuelle en deux acquisitions. Liste root_id=workspace, path=toolchain/tc-list-read-01, pattern=*.txt, recursive=false, limit=8. Le resultat du listing determine le second appel : le nom active--<NEXT_TOOL>--... donne l'outil 2 et son path. Pour cette lecture du workspace, utilise exactement read_workspace_file (lie a root_id=workspace) avec path, offset=0 et max_characters=4096; root_id n'est pas un argument de cet outil. N'invente aucune donnee. Reponds uniquement par le JSON exact {\"target\":\"<TARGET obtenu>\"}.",
      "final_token": "TARGET-31BD55DE0B1E",
      "expected_calls": [
        {
          "tool_id": "list_files",
          "arguments": {
            "root_id": "workspace",
            "path": "toolchain/tc-list-read-01",
            "pattern": "*.txt",
            "recursive": false,
            "limit": 8
          }
        },
        {
          "tool_id": "read_workspace_file",
          "arguments": {
            "path": "toolchain/tc-list-read-01/active--read_workspace_file--SEL-16BE981C2C75.txt",
            "offset": 0,
            "max_characters": 4096
          }
        }
      ],
      "planted_files": [
        {
          "path": "toolchain/tc-list-read-01/active--read_workspace_file--SEL-16BE981C2C75.txt",
          "text": "TARGET=TARGET-31BD55DE0B1E\n"
        },
        {
          "path": "toolchain/tc-list-read-01/archive-a.txt",
          "text": "TARGET=TARGET-D6C994A08719\n"
        },
        {
          "path": "toolchain/tc-list-read-01/archive-b.txt",
          "text": "TARGET=TARGET-D844DC0EDF54\n"
        }
      ],
      "planted_documents": [],
      "info_material": {
        "stage": "before-tool-1",
        "available_locators": [
          {
            "root_id": "workspace",
            "path": "toolchain/tc-list-read-01",
            "pattern": "*.txt"
          }
        ]
      }
    },
    {
      "id": "tc-list-read-02",
      "probe_id": "toolchain.execute",
      "case_type": "procedural-chain",
      "timeout_seconds": 3600,
      "pattern": "list-read",
      "prompt": "Execute une chaine factuelle en deux acquisitions. Liste root_id=workspace, path=toolchain/tc-list-read-02, pattern=*.txt, recursive=false, limit=8. Le resultat du listing determine le second appel : le nom active--<NEXT_TOOL>--... donne l'outil 2 et son path. Pour cette lecture du workspace, utilise exactement read_workspace_file (lie a root_id=workspace) avec path, offset=0 et max_characters=4096; root_id n'est pas un argument de cet outil. N'invente aucune donnee. Reponds uniquement par le JSON exact {\"target\":\"<TARGET obtenu>\"}.",
      "final_token": "TARGET-F5359059BFB7",
      "expected_calls": [
        {
          "tool_id": "list_files",
          "arguments": {
            "root_id": "workspace",
            "path": "toolchain/tc-list-read-02",
            "pattern": "*.txt",
            "recursive": false,
            "limit": 8
          }
        },
        {
          "tool_id": "read_workspace_file",
          "arguments": {
            "path": "toolchain/tc-list-read-02/active--read_workspace_file--SEL-B875B78CCBCA.txt",
            "offset": 0,
            "max_characters": 4096
          }
        }
      ],
      "planted_files": [
        {
          "path": "toolchain/tc-list-read-02/active--read_workspace_file--SEL-B875B78CCBCA.txt",
          "text": "TARGET=TARGET-F5359059BFB7\n"
        },
        {
          "path": "toolchain/tc-list-read-02/archive-a.txt",
          "text": "TARGET=TARGET-8A27F531DE89\n"
        },
        {
          "path": "toolchain/tc-list-read-02/archive-b.txt",
          "text": "TARGET=TARGET-F16C1F3DD194\n"
        }
      ],
      "planted_documents": [],
      "info_material": {
        "stage": "before-tool-1",
        "available_locators": [
          {
            "root_id": "workspace",
            "path": "toolchain/tc-list-read-02",
            "pattern": "*.txt"
          }
        ]
      }
    },
    {
      "id": "tc-list-read-03",
      "probe_id": "toolchain.execute",
      "case_type": "procedural-chain",
      "timeout_seconds": 3600,
      "pattern": "list-read",
      "prompt": "Execute une chaine factuelle en deux acquisitions. Liste root_id=workspace, path=toolchain/tc-list-read-03, pattern=*.txt, recursive=false, limit=8. Le resultat du listing determine le second appel : le nom active--<NEXT_TOOL>--... donne l'outil 2 et son path. Pour cette lecture du workspace, utilise exactement read_workspace_file (lie a root_id=workspace) avec path, offset=0 et max_characters=4096; root_id n'est pas un argument de cet outil. N'invente aucune donnee. Reponds uniquement par le JSON exact {\"target\":\"<TARGET obtenu>\"}.",
      "final_token": "TARGET-236233C28061",
      "expected_calls": [
        {
          "tool_id": "list_files",
          "arguments": {
            "root_id": "workspace",
            "path": "toolchain/tc-list-read-03",
            "pattern": "*.txt",
            "recursive": false,
            "limit": 8
          }
        },
        {
          "tool_id": "read_workspace_file",
          "arguments": {
            "path": "toolchain/tc-list-read-03/active--read_workspace_file--SEL-DB7ED3F146DB.txt",
            "offset": 0,
            "max_characters": 4096
          }
        }
      ],
      "planted_files": [
        {
          "path": "toolchain/tc-list-read-03/active--read_workspace_file--SEL-DB7ED3F146DB.txt",
          "text": "TARGET=TARGET-236233C28061\n"
        },
        {
          "path": "toolchain/tc-list-read-03/archive-a.txt",
          "text": "TARGET=TARGET-BBE1BD950B3C\n"
        },
        {
          "path": "toolchain/tc-list-read-03/archive-b.txt",
          "text": "TARGET=TARGET-631D7CB79299\n"
        }
      ],
      "planted_documents": [],
      "info_material": {
        "stage": "before-tool-1",
        "available_locators": [
          {
            "root_id": "workspace",
            "path": "toolchain/tc-list-read-03",
            "pattern": "*.txt"
          }
        ]
      }
    },
    {
      "id": "tc-list-read-04",
      "probe_id": "toolchain.execute",
      "case_type": "procedural-chain",
      "timeout_seconds": 3600,
      "pattern": "list-read",
      "prompt": "Execute une chaine factuelle en deux acquisitions. Liste root_id=workspace, path=toolchain/tc-list-read-04, pattern=*.txt, recursive=false, limit=8. Le resultat du listing determine le second appel : le nom active--<NEXT_TOOL>--... donne l'outil 2 et son path. Pour cette lecture du workspace, utilise exactement read_workspace_file (lie a root_id=workspace) avec path, offset=0 et max_characters=4096; root_id n'est pas un argument de cet outil. N'invente aucune donnee. Reponds uniquement par le JSON exact {\"target\":\"<TARGET obtenu>\"}.",
      "final_token": "TARGET-F6C97D441EA7",
      "expected_calls": [
        {
          "tool_id": "list_files",
          "arguments": {
            "root_id": "workspace",
            "path": "toolchain/tc-list-read-04",
            "pattern": "*.txt",
            "recursive": false,
            "limit": 8
          }
        },
        {
          "tool_id": "read_workspace_file",
          "arguments": {
            "path": "toolchain/tc-list-read-04/active--read_workspace_file--SEL-F09B21C68A73.txt",
            "offset": 0,
            "max_characters": 4096
          }
        }
      ],
      "planted_files": [
        {
          "path": "toolchain/tc-list-read-04/active--read_workspace_file--SEL-F09B21C68A73.txt",
          "text": "TARGET=TARGET-F6C97D441EA7\n"
        },
        {
          "path": "toolchain/tc-list-read-04/archive-a.txt",
          "text": "TARGET=TARGET-6F7426AB66F2\n"
        },
        {
          "path": "toolchain/tc-list-read-04/archive-b.txt",
          "text": "TARGET=TARGET-C1F19A780EF1\n"
        }
      ],
      "planted_documents": [],
      "info_material": {
        "stage": "before-tool-1",
        "available_locators": [
          {
            "root_id": "workspace",
            "path": "toolchain/tc-list-read-04",
            "pattern": "*.txt"
          }
        ]
      }
    },
    {
      "id": "tc-list-read-05",
      "probe_id": "toolchain.execute",
      "case_type": "procedural-chain",
      "timeout_seconds": 3600,
      "pattern": "list-read",
      "prompt": "Execute une chaine factuelle en deux acquisitions. Liste root_id=workspace, path=toolchain/tc-list-read-05, pattern=*.txt, recursive=false, limit=8. Le resultat du listing determine le second appel : le nom active--<NEXT_TOOL>--... donne l'outil 2 et son path. Pour cette lecture du workspace, utilise exactement read_workspace_file (lie a root_id=workspace) avec path, offset=0 et max_characters=4096; root_id n'est pas un argument de cet outil. N'invente aucune donnee. Reponds uniquement par le JSON exact {\"target\":\"<TARGET obtenu>\"}.",
      "final_token": "TARGET-2336CCD86FAF",
      "expected_calls": [
        {
          "tool_id": "list_files",
          "arguments": {
            "root_id": "workspace",
            "path": "toolchain/tc-list-read-05",
            "pattern": "*.txt",